search,visits,guests,clicks,active,costs
бишкек яндекс такси для водителей,1,1,1,0,"14,517"
городе бишкек кыргызстан работа яндекс такси сколько зарабатывает яндекс такси водителей,1,1,1,0,"10,269"
как подключить яндекс такси бишкек,1,1,1,1,"9,762"
как работает яндекс такси,1,1,1,0,"7,249"
как устроится службу яндекс такси без своей машины,1,1,1,0,"9,911"
как устроиться в яндекс такси,1,1,1,0,"14,705"
как устроиться в яндекс такси без машины в бишкеке,1,1,1,0,"11,515"
как устроиться в яндекс такси в бишкеке,1,1,1,0,"8,553"
как устроиться в яндекс такси на своем авто в бишкеке,1,1,1,0,"7,064"
как устроиться в яндекс такси на своем авто кыргызстане,0,0,1,0,"13,084"
как устроиться яндекс такси,2,2,2,0,"13,605"
программа яндекс такси для водителей,1,1,1,0,"14,302"
работа в яндекс такси,1,1,2,0,"20,13"
работа в яндекс такси в бишкеке,1,1,1,0,"15,134"
работа в яндекс такси на своем авто,1,1,1,0,"11,301"
работа на яндекс такси в бишкеке,0,0,1,0,"13,713"
работа яндекс такси в бишкеке,4,3,2,0,"33,699"
работа яндекс такси россии,1,1,1,0,"6,2"
регистрация водителей в яндекс такси бишкек,1,1,1,0,"9,135"
скачать яндекс такси на телефон водитель,1,1,1,0,"12,891"
стать таксистом яндекс такси бишкек,1,1,1,0,"8,019"
схема работы яндекс такси,1,1,1,0,"17,313"
требуются водители в яндекс такси бишкек,1,1,1,0,"5,8"
требуются водители яндекс такси,1,1,1,0,"13,35"
условия работы в яндекс такси в бишкеке,1,1,1,0,"13,083"
условия работы в яндекс такси на авто,1,1,1,0,"8,66"
устройство на работу в яндекс такси бишкеке,1,1,1,0,"23,466"
хочешь устраивать водителей в яндекс такси,1,1,1,0,"9,285"
я хочу работать яндекс такси бишкек,1,1,1,0,"9,683"
яндекс водитель такси,0,0,1,0,"13,805"
яндекс такси бишкек вакансии,1,1,1,0,"14,016"
яндекс такси бишкек водитель,1,1,1,0,"12,027"
яндекс такси бишкек работ,1,1,1,0,"27,258"
яндекс такси бишкек работа,1,1,1,0,"12,142"
яндекс такси в бишкеке для водителей,3,1,3,1,"18,496"
яндекс такси в бишкеке набор водителей,0,0,1,0,"8,601"
яндекс такси в бишкеке работа,2,1,2,1,"41,701"
яндекс такси в бишкеке стать таксистом,1,1,1,0,"8,464"
яндекс такси в бишкеке устроиться,0,0,2,0,"23,905"
яндекс такси в водителям,1,1,1,0,"2,744"
яндекс такси в москве работа,1,1,1,0,"9,387"
яндекс такси информация для водителей,1,1,1,0,"17,184"
яндекс такси работа,1,1,1,0,"4,495"
яндекс такси работа бишкек,2,1,2,0,"15,62"
яндекс такси работа в бишкеке,1,1,1,0,"10,31"
яндекс такси регистрация водителей без лицензии,0,0,1,0,"20,474"